{"findings":[{"finding_id":"fixture-alpha","reason":"","status":"Not a Finding","summary":"Generated synthetic finding fixture-alpha."},{"finding_id":"fixture-beta","reason":"","status":"Not a Finding","summary":"Generated synthetic finding fixture-beta."},{"finding_id":"fixture-gamma","reason":"","status":"Not a Finding","summary":"Generated synthetic finding fixture-gamma."},{"finding_id":"fixture-delta","reason":"Synthetic fixture excludes this capability.","status":"Not Applicable","summary":"Generated synthetic finding fixture-delta."}],"format":"wormhole.synthetic-checklist","schema_version":"1.0","synthetic":true}
